{
  "paper_id": "math_sum_evens",
  "schema_version": "0.1.0",
  "verification_boundary": "human_review_only",
  "metadata": {
    "provider": "prime_intellect",
    "model": "allenai/olmo-3.1-32b-instruct",
    "model_version": null,
    "created_at": "2026-03-20T13:24:02Z",
    "latency_seconds": 4.014,
    "temperature": null,
    "top_p": null,
    "max_tokens": null,
    "seed": null,
    "prompt_template_id": null,
    "prompt_template_sha256": null,
    "input_artifact_sha256": null,
    "prompt_tokens": 589,
    "completion_tokens": 119,
    "total_tokens": 708,
    "estimated_cost_usd": null,
    "reviewer_decision": null,
    "promotion_outcome": null,
    "notes": null
  },
  "proposals": [
    {
      "claim_id": "math_sum_evens_claim_001",
      "lean_declaration_short_name": "sum_evens",
      "rationale": "The Lean theorem in the provided namespace is named 'sum_evens' and directly corresponds to the claim about the sum of two even natural numbers.",
      "confidence": 1.0
    }
  ]
}